{
  "type": "root",
  "id": "R01",
  "data": {
    "backgroundUri": null,
    "coverUri": null,
    "language": "en",
    "logoUri": null,
    "title": "A Survey Title",
    "version": "1.0.0"
  },
  "children": [
    {
      "type": "question",
      "id": "B01",
      "value": "A value.",
      "data": {
        "isHidden": false,
        "isRequired": false,
        "pageIndex": 0,
        "pageRankIndex": 0
      }
    }
  ]
}
